{
  "schema_version": "obs.v0.1",
  "captured_at": "2026-01-11T00:00:00Z",
  "source": "deployed",
  "assets": [
    {
      "id": "arn:aws:kms:us-east-1:111122223333:key/mrk-dbcdef1234567890",
      "type": "aws_kms_key",
      "vendor": "aws",
      "properties": {
        "cryptography": {
          "kind": "key",
          "lifecycle": {
            "pending_deletion": false
          },
          "key_rotation_enabled": true
        }
      }
    }
  ]
}
