{
  "schema_version": "obs.v0.1",
  "captured_at": "2026-01-11T00:00:00Z",
  "source": "deployed",
  "assets": [
    {
      "id": "lt-0latestdefault",
      "type": "aws_ec2_launch_template",
      "vendor": "aws",
      "properties": {"compute":{"kind":"launch_template","launch_template":{"using_latest":true,"default_version":7,"latest_version":7,"version_delta":0}}}
    }
  ]
}
