{"schema_version":"obs.v0.1","captured_at":"2026-01-01T00:00:00Z","source":"deployed","assets":[{"id":"HOSTED_ZONE/record","type":"aws_route53_record","vendor":"aws","properties":{"network":{"kind":"route53_record","dns":{"record_name":"app.example.com","target_type":"elasticbeanstalk","target_exists":true,"has_dangling_beanstalk_target":false}}}}]}
