{
  "schema_version": "obs.v0.1",
  "generated_by": {
    "source_type": "aws-s3-snapshot",
    "tool": "terraform",
    "tool_version": "1.9.8"
  },
  "captured_at": "2026-01-01T00:00:00Z",
  "assets": [
    {
      "id": "public-no-condition",
      "type": "aws_s3_bucket",
      "vendor": "aws",
      "properties": {
        "storage": {
          "kind": "bucket",
          "name": "public-no-condition",
          "controls": {
            "public_access_fully_blocked": false,
            "account_public_access_fully_blocked": false,
            "public_access_block": {
              "block_public_acls": false,
              "ignore_public_acls": false,
              "block_public_policy": false,
              "restrict_public_buckets": false
            }
          },
          "encryption": {
            "at_rest_enabled": true,
            "algorithm": "AES256",
            "kms_key_id": "",
            "in_transit_enforced": false
          },
          "versioning": {
            "enabled": false,
            "mfa_delete_enabled": false
          },
          "logging": {
            "enabled": true,
            "target_bucket": "",
            "target_prefix": ""
          },
          "access": {
            "external_accounts": null,
            "has_external_access": false,
            "has_wildcard_principal": false,
            "public_read": true,
            "public_list": false,
            "public_write": false,
            "read_via_identity": false,
            "read_via_resource": false,
            "list_via_identity": false,
            "has_ip_condition": false,
            "has_vpc_condition": false,
            "effective_network_scope": "public"
          }
        }
      }
    },
    {
      "id": "vpc-conditioned",
      "type": "aws_s3_bucket",
      "vendor": "aws",
      "properties": {
        "storage": {
          "kind": "bucket",
          "name": "vpc-conditioned",
          "controls": {
            "public_access_fully_blocked": false,
            "account_public_access_fully_blocked": false,
            "public_access_block": {
              "block_public_acls": false,
              "ignore_public_acls": false,
              "block_public_policy": false,
              "restrict_public_buckets": false
            }
          },
          "encryption": {
            "at_rest_enabled": true,
            "algorithm": "AES256",
            "kms_key_id": "",
            "in_transit_enforced": false
          },
          "versioning": {
            "enabled": false,
            "mfa_delete_enabled": false
          },
          "logging": {
            "enabled": true,
            "target_bucket": "",
            "target_prefix": ""
          },
          "access": {
            "external_accounts": null,
            "has_external_access": false,
            "has_wildcard_principal": false,
            "public_read": false,
            "public_list": false,
            "public_write": false,
            "read_via_identity": false,
            "read_via_resource": false,
            "list_via_identity": false,
            "has_ip_condition": false,
            "has_vpc_condition": true,
            "effective_network_scope": "vpc-restricted"
          }
        }
      }
    },
    {
      "id": "ip-conditioned",
      "type": "aws_s3_bucket",
      "vendor": "aws",
      "properties": {
        "storage": {
          "kind": "bucket",
          "name": "ip-conditioned",
          "controls": {
            "public_access_fully_blocked": false,
            "account_public_access_fully_blocked": false,
            "public_access_block": {
              "block_public_acls": false,
              "ignore_public_acls": false,
              "block_public_policy": false,
              "restrict_public_buckets": false
            }
          },
          "encryption": {
            "at_rest_enabled": true,
            "algorithm": "AES256",
            "kms_key_id": "",
            "in_transit_enforced": false
          },
          "versioning": {
            "enabled": false,
            "mfa_delete_enabled": false
          },
          "logging": {
            "enabled": true,
            "target_bucket": "",
            "target_prefix": ""
          },
          "access": {
            "external_accounts": null,
            "has_external_access": false,
            "has_wildcard_principal": false,
            "public_read": false,
            "public_list": false,
            "public_write": false,
            "read_via_identity": false,
            "read_via_resource": false,
            "list_via_identity": false,
            "has_ip_condition": true,
            "has_vpc_condition": false,
            "effective_network_scope": "ip-restricted"
          }
        }
      }
    },
    {
      "id": "securetransport-only",
      "type": "aws_s3_bucket",
      "vendor": "aws",
      "properties": {
        "storage": {
          "kind": "bucket",
          "name": "securetransport-only",
          "controls": {
            "public_access_fully_blocked": false,
            "account_public_access_fully_blocked": false,
            "public_access_block": {
              "block_public_acls": false,
              "ignore_public_acls": false,
              "block_public_policy": false,
              "restrict_public_buckets": false
            }
          },
          "encryption": {
            "at_rest_enabled": true,
            "algorithm": "AES256",
            "kms_key_id": "",
            "in_transit_enforced": true
          },
          "versioning": {
            "enabled": false,
            "mfa_delete_enabled": false
          },
          "logging": {
            "enabled": true,
            "target_bucket": "",
            "target_prefix": ""
          },
          "access": {
            "external_accounts": null,
            "has_external_access": false,
            "has_wildcard_principal": false,
            "public_read": true,
            "public_list": false,
            "public_write": false,
            "read_via_identity": false,
            "read_via_resource": false,
            "list_via_identity": false,
            "has_ip_condition": false,
            "has_vpc_condition": false,
            "effective_network_scope": "public"
          }
        }
      }
    }
  ],
  "source": "deployed"
}
