{
  "assets": [
    {
      "id": "arn:aws:iam::111122223333:user/bob",
      "properties": {
        "identity": {
          "kind": "user",
          "policy": {
            "iam_admin_missing_sourceip": false
          }
        }
      },
      "type": "aws_iam_user",
      "vendor": "aws"
    }
  ],
  "captured_at": "2026-01-11T00:00:00Z",
  "schema_version": "obs.v0.1",
  "source": "deployed"
}
