{
  "schema_version": "obs.v0.1",
  "captured_at": "2026-01-01T00:00:00Z",
  "source": "deployed",
  "assets": [
    {
      "id": "defender-storage",
      "type": "azure_defender_setting",
      "vendor": "azure",
      "properties": {
        "azure": {
          "monitoring": {
            "kind": "defender_setting",
            "defender": {
              "enabled": true,
              "plan": "StorageAccounts",
              "pricing_tier": "Standard"
            }
          }
        }
      }
    }
  ]
}
