{
  "schema_version": "obs.v0.1",
  "captured_at": "2026-01-01T00:00:00Z",
  "source": "deployed",
  "assets": [
    {
      "id": "arn:aws:s3:::prod-data-safe",
      "type": "aws_s3_bucket",
      "vendor": "aws",
      "properties": {
        "storage": {
          "kind": "bucket",
          "encryption": {
            "kms_key_policy_broad": false
          }
        }
      }
    }
  ]
}
