{
  "schema_version": "obs.v0.1",
  "captured_at": "2026-01-01T00:00:00Z",
  "source": "deployed",
  "assets": [
    {
      "id": "alert-policy",
      "type": "gcp_monitoring_alert",
      "vendor": "gcp",
      "properties": {
        "gcp": {
          "monitoring": {
            "kind": "alert_policy",
            "alert": {
              "name": "security-alert",
              "enabled": true,
              "has_notification_channel": true,
              "notification_channels": [
                "email-oncall"
              ]
            }
          }
        }
      }
    }
  ]
}
