{
  "schema_version": "obs.v0.1",
  "captured_at": "2026-01-01T00:00:00Z",
  "source": "deployed",
  "assets": [
    {
      "id": "snap-0activeamicurr",
      "type": "aws_ebs_snapshot",
      "vendor": "aws",
      "properties": {"compute":{"kind":"ebs_snapshot","snapshot":{"source_ami_deregistered":false,"source_ami_id":"ami-0activeami123"}}}
    }
  ]
}
