{
  "schema_version": "obs.v0.1",
  "captured_at": "2026-08-01T00:00:00Z",
  "source": "deployed",
  "assets": [
    {
      "vendor": "aws",
      "properties": {
        "cost": {
          "budget": {
            "has_any_budget": true,
            "has_alert_notification": true
          }
        },
        "account_id": "111122223333"
      },
      "id": "arn:aws:budgets::111122223333:account/budget-coverage",
      "type": "aws_account_budget_coverage"
    }
  ],
  "generated_by": {
    "source_type": "aws.config_api",
    "tool": "stave-test",
    "tool_version": "1.0.0"
  }
}
