{
  "schema_version": "obs.v0.1",
  "captured_at": "2026-01-01T00:00:00Z",
  "source": "deployed",
  "assets": [
    {
      "id": "arn:aws:dynamodb:us-east-1:123456789012:table/orders-standard",
      "type": "aws_dynamodb_table",
      "vendor": "aws",
      "properties": {
        "database": {
          "kind": "table",
          "dynamodb": {
            "table_name": "orders-standard",
            "is_global_table": false,
            "global_replica_count": 0
          }
        }
      }
    }
  ]
}
