{
  "schema_version": "obs.v0.1",
  "generated_by": {
    "source_type": "aws-s3-snapshot",
    "tool": "terraform",
    "tool_version": "1.9.8"
  },
  "captured_at": "2026-01-11T00:00:00Z",
  "assets": [
    {
      "id": "patient-records-bucket",
      "type": "aws_s3_bucket",
      "vendor": "aws",
      "properties": {
        "storage": {
          "kind": "bucket",
          "name": "patient-records-bucket",
          "access": {
            "public_read": true,
            "public_list": false,
            "public_write": false,
            "read_via_identity": true,
            "read_via_resource": false,
            "list_via_identity": false
          },
          "controls": {
            "public_access_fully_blocked": false,
            "public_access_block": {
              "block_public_acls": false,
              "ignore_public_acls": false,
              "block_public_policy": false,
              "restrict_public_buckets": false
            }
          }
        }
      }
    }
  ],
  "source": "deployed"
}
